{
  "format": "factory-contract/v1",
  "task_id": "clear-finished",
  "version": "1",
  "goal": "Let the reader remove every finished book from the list in one click, instead of deleting them one by one.",
  "inputs": [
    "README.md describes the app.",
    "src/books.ts holds the pure domain functions; new logic goes there with unit tests in tests/books.test.ts.",
    "src/main.ts wires the page; never assign user data to innerHTML."
  ],
  "repository": "rNavarrete/factory-pilot-demo",
  "base_commit": "6c6badb8f086b7c4a3eaf3ba43317854e87e9b96",
  "permitted_paths": ["src/books.ts", "src/main.ts", "src/style.css", "index.html", "tests/books.test.ts"],
  "permitted_actions": ["modify-files", "add-tests"],
  "risk_markers": [],
  "acceptance_criteria": [
    {
      "id": "ac1",
      "statement": "removeFinished(books) returns only the books whose status is not 'done', in their original order, without changing the input array.",
      "evidence": {"type": "automated-check", "command": "npm test"},
      "status": "ready"
    },
    {
      "id": "ac2",
      "statement": "A 'Clear finished' button removes every book marked done from the list, and the change is still there after a page reload.",
      "evidence": {
        "type": "observable-behavior",
        "steps": "Add three books, mark two of them done, press 'Clear finished', then reload the page.",
        "expected": "Only the book that was not done is listed, before and after the reload."
      },
      "status": "ready"
    }
  ],
  "verification_commands": ["npm run typecheck", "npm test", "npm run build"],
  "attempt_budget": 2,
  "escalate_to": "rNavarrete",
  "depends_on": []
}
